,Job Title,Salary Estimate,Job Description,Rating,Company Name,Location,Size,Founded,Type of ownership,Industry,Sector,Revenue
40,Senior Data Analyst,£50K - £60K (Glassdoor est.),"Change your job, change your workplace, change your future...


Ricoh are currently recruiting for a Senior Data Analyst based in London to support the development of the Annuity & Service Reporting initiative with the aim of providing high-quality internal and external business information in relation in relation to Service in Ricoh Europe. Support the development of project deployment within Ricoh Europe and across Ricoh Family Group Operating Companies in EMEA region, with particular emphasis on maintaining the MS SQL Server instance and developing efficient data sources for a range of BI/Analytical Tools using tools such as Power BI..

Ricoh transforms organisations, using innovative technologies and services enabling you as an individual to work smarter. This is what we call “empowering digital workplaces”.

In fact the entire Ricoh workforce enjoys our pioneering and innovative ways of working. We like to call it: imagine. change., it’s the ethos of our brand and how we drive positive change for ourselves and others. Our teams are embracing change, fostering new ways of working and we have never been more resolute in our mission - ""you work for us, and we`ll work for you"".

What you will be doing
Support Department Manager with ongoing development of Annuity & Service Reporting Initiatives and deliverables.
Administrate & Develop existing departmental MS SQL Server Instance with an emphasis on owning and improving upon existing ETL processes (SSIS/Powershell). Own design and development new processes with an emphasis on quality, agility and innovation.
Administrate Data transformation & Security (SSMS), and support leverage of data via other tools (e.g. MS SSAS, M365 Productivity applications, MS Power BI , others)
Continuously review processes and policies to improve the analytic environment and maintain availability of consistent & accurate information supporting Annuity & Service within EMEA.
Maintain a practical level of documentation (SQL comments, schema diagrams, etc in addition to written documentation)
Collect and analyze all relevant data in order to provide exemplary Insight-to-Action support to all Annuity & Service activities.
Contribute to the further development of management information systems and de-duplication of existing processes. Support the business transition to a data-led process management culture.
Lead additional project initiatives as needed at direction of Department Manager.
Participate, support and actively work on the processes of the department
Contribute to Annuity team improvement programmes and Operating Company support
Support customer reporting (external) team activities
Identify potential efficiencies within the department and promote improvements
Contribute to any additional activities when required
You will ideally have


Knowledge, Skills & Experience

Essential Criteria:
Passionate about business intelligence, data integration, data modeling, data manipulation and data management
Experienced in handling large datasets with efficiency and accuracy. Must be adept at validating and proving own work.
Experience supporting business analysts to define and deliver advanced data modeling needs
Relevant experience of performance measurement, management reporting and delivery.
Broad capability across on-premise Microsoft data applications (MS SQL Server + SSIS,SSMS,SSRS)
Excellent T-SQL (query, views, stored procedures) accuracy and structure (comments, optimization, self-testing, maintenance of best-practice)
Process driven individual; Strong ability to manage interdependent processes
Detail driven with a passion for data quality and the application of data quality tools
Creative and solution-oriented attitude, demonstrating empathy for stakeholder needs, able to propose ideal, next-best or alternate solutions
Impeccable communication skills; Can detail complex topics to a mixed audience
Excellent organizational skills and self-management
Enthusiastic and committed team member
Proactive and constructive approach to data governance
Desirable Criteria:
Passionate about Data Science and/or Data Engineering.
Experience using MS Power BI or equivalent current leading BI tools
Experience using or administrating MS Power BI on-premise Report Server
MS Powershell proficiency
Knowledge of MS Active Directory / LAN / WAN infrastructure
Foundation knowledge of IT Security requirements (ISO 27001/9001 etc.) and data-related legislation such as GDPR
Exposure to International business processes and working cultures
Experience in developing Service Delivery or Financial Business Intelligence
Familiarity with DataOps process and ethos
Aspiration to support (scope, business case, proof of concept, design, deliver, educate and communicate) future migration to next-gen i.e. cloud-based analytics platform
In return for your commitment, you can expect


• A competitive salary package
• Industry leading benefits

Ricoh is an exceptional place to work. A place where there is strong emphasis on career development for the right individuals. This is a role where you can excel within a fast-paced environment and succeed within a thriving organisation.

This is an excellent opportunity to join a global company where you can truly capitalise and build on your own experience.

Ready to make that change? Apply now for a confidential conversation with our Recruitment Team.

We are an equal opportunities employer


Ricoh have removed the disclosure of convictions box from their application process (ban the box - http://www.bitc.org.uk/programmes/ban-box) offering equal opportunities to all. For all roles, we will judge each individual on their skills and ability before taking into account their history. However some roles are subject to sensitive and restrictive information and, if successful, you may be required to undertake pre-employment vetting checks which include but are not limited to residency check, credit reference check, financial sanctions` check and a DBS Check. Further information on Employment Vetting can be accessed by contacting the Ricoh Recruitment Team.",2.4,"Ricoh UK
2.4","London, England",1001 to 5000 Employees,1936,Subsidiary or Business Segment,IT Services,Information Technology,$100 to $500 million (USD)
41,Global Data Analyst - Marine Insurance,£50K - £60K (Glassdoor est.),"Marsh is the world’s leading insurance broker and risk adviser. With over 35,000 colleagues operating in more than 130 countries, Marsh serves commercial and individual clients with data driven risk solutions and advisory services
The role:
We are recruiting a Global Data Analyst to join our team in London.
As a Global Data Analyst you will be the principal contact point for Data & Analytics project co-ordination across the global Marsh Marine network, managed from the UK Specialty hub and champion the use of data/analytics across the division globally.
What can you expect?
You will be working at the cutting edge of the industry for one of the leaders in the field
You will be collaborating with the Data Projects Leader to set effective levels of expectation around what is achievable with current set of resources available and what should be prioritised for process efficiencies and/or superior analytical outcomes moving forward.
What you will be rewarded with?
We offer competitive salaries and comprehensive benefits
26 Days Annual Leave, with the option to buy or sell up to 5 days per year
Excellent defined contribution pension scheme with up to 12% employer contribution (based on a 4% employee contribution)
Private Medical Insurance
Flexible Working (condensed hours/working from home)** subject to manager approval
Full training on Marsh products and ongoing professional development
We will rely on you to:
Be the custodian of the Target Operating Model (TOM) for Data & Analytics projects as defined by the core Marine projects implementation team in consultation with technical Centres of Excellence across the wider MMC group.
Monitor the global inflow of key documentation and data feeds. Underpinned by a willingness to intervene where necessary, coach regional contacts to facilitate effective relationships and prioritise co-operative problem solving wherever practicable.
Act as a first line of contact for Sanctions related queries, escalating to appropriate colleagues and senior management as required.
Take on “Super User” responsibilities for dashboards/platforms that are developed in conjunction with internal/external dedicated teams and providers.
What you need to have:
Educated to Degree level in a Business, Scientific or Mathematical relevant subject area.
Proficiency across all standard Microsoft Office suite products with an emphasis on MS Excel and PowerPoint.
Experience with Data Visualisation tools such as; Qlik/PowerBI/Tableau.
What makes you stand out?
A rudimentary understanding or interest in the Maritime Industry.
Marsh is the world’s leading insurance broker and risk adviser. With over 35,000 colleagues operating in more than 130 countries, Marsh serves commercial and individual clients with data driven risk solutions and advisory services. Marsh is a business of Marsh & McLennan Companies (NYSE: MMC), the world’s leading professional services firm in the areas of risk, strategy and people, with 76,000 colleagues and annualized revenue approaching $17 billion. Through its market-leading businesses, including Mercer, Guy Carpenter and Oliver Wyman, Marsh & McLennan helps clients navigate an increasingly dynamic and complex environment.",3.7,"Marsh and McLennan
3.7","London, England",10000+ Employees,1871,Company - Public,Insurance Agencies & Brokerages,Insurance,$10+ billion (USD)
42,Data Analyst – London,£50K - £60K (Glassdoor est.),"Data
London, UK
Permanent
£50,000 - £70,000 per annum + extensive benefits
1222
Data Analyst – IFRS17 | London | £50,000 – £70,000 per year
IFRS17 is possibly the biggest regulation change occurring in the world right now and we’re in need of a data analyst to work with one of the world’s leading financial institutions on this. If you have solid data management skills and a sound understanding of IFRS17 then we would love to hear from you.
You will join an organisation that truly promotes diversity and be encouraged to achieve your own goals whilst sharing the success of this award-winning business. Whether this is by acquiring new skills or exploring new opportunities within the business, you will be given the resources to grow professionally and personally.
The data analyst will work in the insurance arm of a multinational finance giant, helping to steer their data process to BAU inline with IFRS17 regulations. You will collaborate with a talented team and contribute to the long-term goal of ensuring quality data.
What you’ll do as a data analyst:
Ensure data requirements are being adhered to in the context of ETL across the different stages in IFRS17
Work with different data sources, specifying processing requirements and proposing solutions for correcting data issues
Collaborate with the data architect as well as other technical stakeholders to document data processing requirements in line with IFRS17 data preparation
Introduce new data process to be compliant with audit requirements
Document as-is and to-be architectures
Carry out data quality checks and maintain data quality
What you’ll need for the data analyst role:
IFRS17 experience – a sound knowledge or experience working on similar projects
Experience working with multiple data architecture systems
Strong data management experience including good practice of data governance
Experience with financial or insurance data
This role is suited to someone who wants to take on a dynamic role that is very project-based. The long-term goal is to achieve BAU, which means in the short-term you will be taking on new challenges every day. After this IFRS17 regulation has come in, there is seemingly an infinite number of opportunities that you could involve yourself in at the business, depending on the direction you’d like to go!
You will be rewarded with very generous benefits that we are happy to discuss that comes with this opportunity. It’s okay if you don’t have a complete or up to date CV, please apply and we can discuss the data analyst role in more detail.",4.4,"kdr Recruitment
4.4","London, England",1 to 50 Employees,2003,Company - Private,IT Services,Information Technology,Unknown / Non-Applicable
43,Data Cost Analyst,£50K - £60K (Glassdoor est.),"Faithful+Gould is an international company with great strength and a culture of progression. Placing great emphasis on the training, development and assessment of our staff, we are dedicated to providing cutting-edge expertise. Join us and you will benefit from a development programme across our Transportation and Infrastructure Portfolio designed to ensure your career objectives are met in full.
As a Data Cost Analyst, you will analyse data from our industry leading Cost systems used across our Programme portfolio and/or specific projects together with industry best practice data to ensure that accurate figures can be used confidently by internal and external stakeholders.
About the role (accountabilities include but are not limited to):
Undertake analysis of outputs from contract Cost reports and/or project wide reports to support
accurate reporting, benchmarking and analysis of infrastructure Costs;
Ensure that cost information received is harvested and incorporated into systems, in order to drive the mechanics behind the systems for Earned Value and world class Cost reporting;
Draw on industry best practice in the development and maintenance of Cost systems to
ensure consistent best in class approaches and decision making across project portfolio; and
Provide support to the development of programme wide models including (amongst others) indirect costs, whole life, and prelims.
About You:
Degree or equivalent experience or achieved NVQ Level 2 in Project Controls and working towards membership of the RICS, ACostE, ICES or similar relevant professional association;
Commercial and quantity surveying skills, with an understanding of the construction industry, in particular NEC Form of Contracts and their commercial basis;
Understanding of the cost drivers that define a project and ability to analyse and convert project data into meaningful cost analysis and reporting;
Knowledge of performance measurement of projects using Earned Value Management and similar techniques;
Knowledge of cost systems, such as SAP, Oracle CostOS and PRISM; and
Experience of interfacing with the client organisation at a junior level.
It is expected that you will actively promote and embed Equality, Diversity and Inclusion (EDI) in all your work and support and comply with all organisational initiatives, policies and procedures on EDI.
Training:
You should possess a willingness to continue to develop your career through our structured training programme. Faithful+Gould provides a portfolio of training and development courses designed to help you make the best of your abilities and talents and also encourage Continuous Professional Development Activities.
Rewards and Benefits:
Faithful+Gould offers a fantastic range of benefits, which you can tailor to suit your own health, wellbeing, financial and lifestyle choices. All the information you need to know is available on our dedicated benefits portal; your reward, which is available to access 24/7 from any device: https://www.yourrewardatkins.com
Security Clearance:
This role may require security clearance and offers of employment will be dependent on obtaining the relevant level of clearance. If this is necessary it will be discussed with you at interview.
If applying to this role please do not make reference to (in conversation) or include in your application or CV, details of any current or previously held security clearance.
Faithful+Gould recognise that there are many well qualified people who are looking to further their career, but who cannot commit to full time employment. We support flexible working arrangements and are interested to discuss how we can accommodate individual requirements.
Faithful+Gould,a member of the SNC-Lavalin Group, is committed to having a diverse and inclusive workforce. As an Equal Opportunities Employer, we value applications from all backgrounds, cultures and ability.",3.8,"Faithful+Gould
3.8","London, England",1001 to 5000 Employees,1947,Subsidiary or Business Segment,Consulting,Business Services,$100 to $500 million (USD)
44,Business Operationall Analyst- Data-Manufacturing,£50K - £60K (Glassdoor est.),"Business Operationall Analyst- Data-Manufacturing

Business Operational Analyst - Data- Manufacturing

* 12 month Contract PAYE

Our client is looking for an Analyst to join their global service operations team based out of London. This newly created role will support the Programme Manager to help improve and automate processes as well as to provide insights, analyse business trends and help develop better reporting. They would like someone from an operations/manufacturing or supply chain/logistics background. You will need a minimum of 3 years experience, have a good understanding of mathematical principles or accounting and be data savvy. Further wishes include strong excel, Tableau and Power BI. This role is remote to start but will be a mix of office in London and working from home after restrictions end.

Please send your cv to barbara.munnelly@harveynash.com

Hi I'm Barbara,

I manage this role
Contact Me

View my profile

EmailBarbara.Munnelly@HarveyNash.com

Phone No:00442073331511

London

Salary
Negotiable


Job type

Contract

Apply",4.0,"Harvey Nash Group
4.0","London, England",501 to 1000 Employees,1988,Company - Private,Staffing & Outsourcing,Business Services,$500 million to $1 billion (USD)
45,Senior Data Analyst - Tableau,£50K - £60K (Glassdoor est.),"About the role

As Senior Data Analyst you will use data intelligence to produce insights into customer behaviour to help guide client strategy and planning decisions and to support the company's thought leadership positioning in the industry.

The role is a highly collaborative one, supporting key functions of the IDP Connect team in their mission to enhance client capabilities with the transformative power of data, insights and engaged student communities.

Working with internal stakeholders to inform evidence-based decision making in projects aimed at growing our influence in the international education community and supporting the direction of new products, services and operating models.

Key responsibilities
Support client planning and strategy through data mining, detailed analysis and identification of critical insights into client behaviour and emerging market trends, converting analytical findings into meaningful and actionable insights.
Support industry engagement initiatives through data mining for the development and provision of reports and presentations for internal and external consumption. This may include the sourcing, analysis and on-going management of new and existing data within appropriate data architecture.
Regularly informs IDP's business operations with relevant research, data and market intelligence. Develop models and reports to share observations and recommendations with relevant business departments.
Monitor the quality and effectiveness of data-sets and develop strategies for their enhancement.
Build, use, adapt and improve data dashboards to satisfy internal and external demands.
Help educate internal and external stakeholders on the use of data and analytics in strategic planning and decision making. There may be direct client interaction, e.g. system training sessions to aid the interpretation of data by clients, and the facilitation of data share arrangements to maximise its value to clients.
About you
Current experience working as a data analyst with experience of data wrangling and manipulation, as well as visualisation
Experience working with large data sets (we have millions of rows of valuable data and we use it every day)
Our large data sets are in Oracle SQL databases and we'll need you to write efficient queries against them
Alteryx experience you'll be using Alteryx within 3 months of joining to help us move our analytics forward
Experience in the end to end of dashboard development, from scoping to design and build, through to delivery
Demonstrable experience with Tableau. We'd love to see your Tableau Public profile, or a portfolio that you can share with us
Understanding of how to manage data on Tableau server
A strong analytical mind and data curiosity
Demonstrable experience of converting analytical findings into actionable insights. Can you provide the so what?' and suggest the what now?' to move our customers beyond the what'?
About us

IDP Connect is a division of IDP Education, global leaders in student marketing and recruitment.

Working with institutions as true partners, IDP Connect understands and enhances our clients' capabilities with the transformative power of data, insights and engaged student communities.

With an entrepreneurial mindset and focus on innovation, IDP Connect creates digital products in collaboration with students that connect them with the right institutions. It also offers a one-stop-shop of services for institutions including in-country promotion, student placement, and onshore arrival services enabling them to reach their global recruitment ambitions.

Currently undergoing an exciting period of growth and product development, IDP Connect is truly embedded in our key markets. We provide access to in-country knowledge and insight from 30+ international student recruitment markets, as well as an annual student audience of 98 million across our digital platforms. Our exclusive real-time data provides institutions with actionable insights to inform their marketing and recruitment strategies.

Together with its partners, IDP Connect plays a vital role in global higher education, building on the trust and connections it has with students throughout the world.

We are committed to equality of opportunity for all employees and applications from individuals are encouraged regardless of age, disability, sex, gender reassignment, sexual orientation, pregnancy and maternity, race, religion or belief and marriage and civil partnerships.

For details on how we store your data please see our Recruitment privacy notice which can be found at:
Click Here

]]>",3.5,"IDP Connect
3.5","London, England",201 to 500 Employees,1996,Company - Private,Colleges & Universities,Education,$10 to $25 million (USD)
