,Job Title,Salary Estimate,Job Description,Rating,Company Name,Location,Size,Founded,Type of ownership,Industry,Sector,Revenue
69,"Senior Technical Business Analyst, Data",£25K - £38K (Glassdoor est.),"Introduction:
This is an exciting time to join the Data & Insights team at The Economist Group. Under our newly appointed Chief Data Officer we are creating a center of excellence spanning research, analytics and data science partnering with the whole group, including our core subscription business, our Economist Intelligence Unit, Client Solutions and Events business. Our purpose is to better understand and affect the drivers of our business through data analytics and research, with a focus on our users, B2C customers and B2B clients. We are value focused and outcome driven: we help drive growth and agility at every level, whether through informing strategic alignment and decisions, providing quick feedback loops to operators or creating machine learning models to be integrated into our products and marketing communications.
Reporting to the Head of Data Product Management, with a dotted line into the Head of Data Engineering, the Senior Technical Business Analyst will assess business requirements for data and data insights, data modelling, designing data-driven processes, and supporting the implementation of data solutions in order to improve our data infrastructure and information technology systems. You will also use the analysis to inform the product management process, developing user stories, evaluating their feasibility, defining acceptance criteria and QAing that those are met. And you will facilitate training and coaching for business data consumers.
To ensure success as a Senior Technical Business Analyst for Data, you should demonstrate experience and creativity in data systems design and implementation. Outstanding Technical Business Analysts combine their technology and data architecture expertise with in-depth business knowledge.
Accountabilities:
How you will contribute:
Working closely with Product Managers, Data Architects and development teams to ensure business data requirements are translated into appropriate technical data solutions, acting as a ‘translator’ between business, data and technology
Supporting Data Product Managers and data lifecycle management, by fielding business requirements, creating backlog tasks, defining technical minimum acceptance criteria, and quality assuring technical solutions prior to implementation
Getting analysis ready for the tech delivery team by performing source data evaluation, data system modelling, data mappings and data flow analysis
Supporting Data Architects in designing effective target-state data infrastructure, by modelling data systems and structures and sharing knowledge of operational and analytical data use cases.
Designing new data solutions by analysing requirements, constructing workflow charts and diagrams, studying data system capabilities and writing data solution specifications.
Providing detailed data mappings between source systems and target data models to the development team, based on business requirements.
Promoting data system efficiency and security by recommending enhancements to data operations and proposing data procedure improvements.
Understanding, interpreting and documenting business processes along with their underpinning data elements.
Defining business rules required to transform data into states that meet data quality and performance standards.
Supporting development and test teams with data requirements, and assisting with data integration and acceptance testing.
Improving the performance of data systems and data support services by efficiently integrating new data systems and applications with business operations and services, and ensuring end-user proficiency with new data systems and applications across departments.
Utilising business and data expertise to facilitate purposeful meetings and collaboration across different lines of business.
Maintaining professional and technical knowledge by attending educational workshops, reviewing professional publications, establishing personal networks, benchmarking state-of-the-art practices and participating in professional societies
Experience, skills and professional attributes:
The ideal skills for this role are:
Strong experience in technical business analysis in a related industry
A Bachelor's Degree in Computer Science or Information Technology, or an accredited qualification is a plus
Experience performing analysis in the context of behavioral data and cloud analytics as well as transactional data
Working knowledge of data architecture principles (such as data warehousing, data lakes, and ETL) as well as data technologies and languages (such as SQL, Python and R).
Proficiency in analytical techniques and notations, such as BPMN and UML.
Ability to self-direct and take on broad projects from beginning to end
Ability to facilitate internal end-user proficiency.
Ability to create and maintain efficient customer support and feedback channels and ensure optimal data system functionality via appropriate diagnostics.
Knowledge of data security and privacy regulations and practices.
Ability to keep up with technology advancements.
Exceptional communication skills, especially in facilitating the use of new technology systems and understanding business requirements with broad set of stakeholders across levels, including senior management as required
Exceptional presentation skills, especially in creating and delivering content in workshops and seminars and ability to present to broad set of stakeholders across levels, including senior management
Leadership skills to establish best practices and collaborative ways of working across functions, create and animate a community of practice for technical business analysis as the team grows.
Attributes required for the role:
Proactive and results oriented
Motivation to perform and succeed
High-energy, robust and resilient
Analytical and driven by insight and understanding
Able to motivate, influence and empower others irrespective of reporting lines
Collaborative, direct and open in approach
Agile mentality - to develop a product management process fostering high-quality iterative delivery while we evolve towards a broader platform vision",3.9,"The Economist Newspaper Limited
3.9","London, England",1001 to 5000 Employees,1843,Company - Private,Publishing,Media,Unknown / Non-Applicable
70,HR Data Analyst & Project Co-ordinator,£25K - £38K (Glassdoor est.),"JOB PURPOSE
As an HR data analyst and project coordinator you will be responsible for the organisations people data, analytics and reporting with a strong focus on DE&I.
This role will be of critical importance in in driving our DE&I agenda across the group, enabling our evidence based approach to delivering a strategy that has a meaningful impact for our people.
You have strong data science skills, knowledge of research design principles, the ability to clearly explain technical concepts to people with non-technical backgrounds, and, of course, an interest in studying people in the workplace. Helping to provide insight to key stakeholders in the wider HR department to enable effective decision making. .
The position will sit at the heart of the DE&I team and play a key role in supporting the senior leaders, team activities and ad hoc projects. The role will spend around 50% of the time analysing, collating and tracking DE&I data for the organisation. This is a demanding role, requiring adherence to high standards and attention to detail. The other 50% will be spent providing direct support and co-ordination to key DE&I projects and timelines. The successful candidate will be able to produce the highest standards of work, meeting tight deadlines and levels of accuracy. They will be have strong initiative, be proactive and be able to find solutions on their own. A ‘can-do’ positive attitude is also a must as is an ability to self-start with enthusiasm and a willingness to take on more responsibility.
If you are passionate about using data to drive meaningful insights that have a real impact for people and culture, then this is the role for you!
KEY ACCOUNTABILITIES
Collects and compiles HR metrics and data from a variety of sources including the human resource information system (HRIS) and payroll outputs, management and employee surveys, exit interviews, employment records, government labour statistics, competitors practices, and other sources.
Analyses data and statistics, with a focus on DE&I, for trends and patterns with attention to recruitment, hiring practices, motivation, turnover, and compliance with employment laws and regulations.
Prepares reports of data results, presenting and explaining findings to senior leadership.
Lead project management for the DE&I team, setting and managing detailed project plans, coordinating actions and supporting the team deliver against tight deadlines
Support the team with creating clear and visually appealing PowerPoint presentations for Executive audiences
Help the wider HR team with data insights, helping them to make evidence led decisions.
Driving improvements for how we collect, interpret and act on diversity data within Liberty Global
Driving the continuous improvement of data quality.
KNOWLEDGE & EXPERIENCE
PREFERRED EDUCATION/ QUALIFICATIONS:
Experience or background in DE&I
General knowledge and understanding of HR policies, processes, regional Employment Laws and total rewards legislative requirements for the relevant region
Experienced with Microsoft Office specifically PPT (Advanced) and excel (Advanced).
SKILLS & ABILITIES:
Strong numerical capability to interpret data and identify trends
Strong initiative and proactive in finding solutions
An adept and confident communicator with strong inter-personal skills, effective in dealing with people at all levels.
Comfortable working as part of a small team in multiple locations
Self-starter who is enthusiastic, willing and able to take on the responsibility
Highly organized, pragmatic and reliable, with a high degree of accuracy through due attention to detail
Flexible outlook, adaptable to changing priorities and comfortable managing workload and deadline pressures that may involve some occasional late working
* Liberty Global is an equal opportunity employer. We embrace diversity and are committed to creating an inclusive environment for our people.
The application process at Liberty Global includes a background check regarding, but not limited to employment, education, reference checks and may include a criminal background check.",3.7,"Liberty Global
3.7","London, England",10000+ Employees,2005,Company - Public,"Cable, Internet & Telephone Providers",Telecommunications,$10+ billion (USD)
71,"Analyst, Client Data Analyst",£25K - £38K (Glassdoor est.),"Mitsubishi UFJ Financial Group, Inc. (MUFG) is one of the world’s leading financial groups. Headquartered in Tokyo and with over 360 years of history, MUFG has a global network with around 3,000 offices in more than 50 markets. The Group has over 180,000 employees, and offers services including commercial banking, trust banking, securities, credit cards, consumer finance, asset management, and leasing.

As one of the top financial groups globally with a vision to be the world's most trusted, we want to attract, nurture and retain the most talented individuals in the market. The size and range of MUFG's global business creates opportunities for our employees to stretch themselves and reap the rewards, whilst our common values, to behave with integrity and responsibility, and to build a culture which is fair, transparent, and honest, underpin everything that we do.We aim to be the financial partner of choice for our clients, whatever their requirements, building long-term relationships, serving society, and fostering shared and sustainable growth for a better world.

Please visit our website for more information - mufgemea.com.

MAIN PURPOSE OF THE ROLE

Within Client Management Services Function, the Data Stream focus is on driving a strategic solution regarding increased quality and visibility of counterparty data.

This role will support ongoing data quality review, data collation, data reconciliations, MI and system feedback in partnership with tech teams for multiple projects.



KEY RESPONSIBILITIES

In this role you will be responsible for:
Data Reconciliation between Client Base and available data for a series of client static data points relevant for regulatory client outreach initiatives.
Data Collation of various data points across multiple systems and spreadsheets covering, but not limited to, data points such as Client Contacts, Salesperson Ownership, Client Hierarchy & LEI information
Support with Internal Outreaches for data clean up / validation to FO teams and collation of responses
Running the BAU data quality validation processes
Support with improvement on identified client data quality issues
Preparing MI showing progress of data collation and progress of data quality improvement
Support Client Outreach initiatives with any scoping requirements & client outreach MI
WORK EXPERIENCE

One or more of the following is essential:
2 - 3 years + in Front Office (1LoD) management environment
2 - 3 years + Project management experience with a proven track record of delivery
SKILLS AND EXPERIENCE

Functional / Technical Competencies:
Advanced Excel
Ability to analyse and interpret data
Problem Solving Skills
A methodical & Logical Approach
Accuracy and attention to detail
Tangible experience of running data and MI initiatives within a complex organizational structure, with the ability to demonstrate successful outcomes
Broad knowledge of investment and corporate banking products and services and how they impact or support clients across sectors / regions.
High level experience/knowledge in IBOR, PSD2, UMR, MIFID, EMIR, CSDR, SFTR


Education / Qualifications:
Degree level education in relevant subject (e.g. finance, maths, physics etc.) (Beneficial)
Other beneficial qualifications (e.g. MBA, CFA, etc.) (Beneficial)


PERSONAL REQUIREMENTS
Excellent communication and presentation skills
Ability to work autonomously
Results driven, with a strong sense of accountability
A proactive, motivated approach
The ability to operate with urgency and prioritise work accordingly
Strong decision making skills, with the ability to demonstrate sound judgement
A structured and logical approach, also demonstrating creativity and innovation in solution forming
Strong problem solving skills
The ability to manage large workloads and tight deadlines
Excellent attention to detail and accuracy
A calm approach, with the ability to perform well in a pressurised environment
Strong numerical skills
Strong teamwork skills and enjoys working within a collaborative culture
We are open to considering flexible working requests in line with organisational requirements.

MUFG is committed to embracing diversity and building an inclusive culture where all employees are valued, respected and their opinions count. We support the principles of equality, diversity and inclusion in recruitment and employment, and oppose all forms of discrimination on the grounds of age, sex, gender, sexual orientation, disability, pregnancy and maternity, race, gender reassignment, religion or belief and marriage or civil partnership.

We make our recruitment decisions in a non-discriminatory manner in accordance with our commitment to identifying the right skills for the right role and our obligations under the law.

Apply",2.7,"Mitsubishi UFJ Securities (USA)
2.7","London, England",201 to 500 Employees,-1,Subsidiary or Business Segment,Investment Banking & Asset Management,Finance,Unknown / Non-Applicable
72,Forensic Data Analyst,£25K - £38K (Glassdoor est.),"Forensic Data Analyst - Big 4 Consultancy - Central London
Join one of the world's leading professional services organisations, with a presence in over 150 countries, and who count some of the most successful organisations on the globe among their clients.
This team is affiliated with the company's Forensic Investigations team, and focuses more on client data and data protection.
The Role
Help clients understand their data (where it is, how they access it) and develop end to end data discovery workflows that meet their needs
Research new technology and products so you can advise clients on the latest cutting-edge software
Understand the challenges modern businesses have in managing data, as well as the risks that data poses to them and how best to help them identify and mitigate those risks
Skills needed:
A 2:1 degree in a technical subject
Previous experience in analysing and helping to resolve business and data issues
Data query and programming languages, such as SQL
Experience using tools such as Tableau, Qlickview, R, Excel
Please get in touch for a confidential conversation",-1,Warner Scott,"London, England",-1,-1,-1,-1,-1,-1
73,Data Warehouse Analyst,£25K - £38K (Glassdoor est.),"Job Description

The Data Warehouse Analyst must be well versed in Business Intelligence reporting. The Data Warehouse Analyst will analyze and evaluate business systems and end user needs, formulate information systems that parallel the corporations overall business strategies. Create reports in a fast paced environment using Cognos and have knowledge of commonly-used concepts, practices, and procedures within operational and financial reporting



Desired Profile
-

Minimum Experience

4 years

Maximum Experience

15 years

Education

MCA/MSc/Engineering Graduate/MBA

Keywords

Data Warehouse, STAR SCHEMA, Oracle 9i, PL/SQL

Email

resumes@gampatech.com",-1,Gampa Technologies,"London, England",-1,-1,-1,-1,-1,-1
74,Senior Data Analyst,£25K - £38K (Glassdoor est.),"Who we are
Artefact is a new generation of a data service provider, specialising in data consulting and data-driven digital marketing, dedicated to transforming data into business impact across the entire value chain of organisations. We are proud to say we're enjoying skyrocketing growth.
Our broad range of data-driven solutions in data consulting and digital marketing are designed to meet our clients' specific needs, always conceived with a business-centric approach and delivered with tangible results. Our data-driven services are built upon the deep AI expertise we've acquired with our 1000+ client base around the globe.
We have 1000 employees across 20 offices who are focused on accelerating digital transformation. Thanks to a unique mix of company assets: State of the art data technologies, lean AI agile methodologies for fast delivery, and cohesive teams of the finest business consultants, data analysts, data scientists, data engineers, and digital experts, all dedicated to bringing extra value to every client.
As a Senior Data & Analytics Consultant, your role will encompass:
Leading ambitious projects in the transformation of your clients businesses through the effective collection, processing and activation of data
Being personally responsible for the quality and continuity of the full range of Data & Analytics services for a particular client
Having a contributor role in raising the level of competencies within the Data & Analytics team
Harnessing the expertise from the other divisions (Media & Activation, Creation, Consultancy, Data Science and Data Infrastructure) to provide comprehensive services to your clients
Among your responsibilities as Senior Data & Analytics Consultant, you will be responsible for:
Leading Data & Analytics projects
Managing the resources on your projects to ensure challenges and skills are well matched
Securing delivery on your projects
Ongoing evaluation of the value brought to our clients' businesses by Data & Analytics services and determining the (next) activity that will likely have the biggest impact
Communicating the successes of your projects within the company and externally
Working closely with experts from other divisions to build and maintain strong relationships with your clients and best understand their needs
Caring for the happiness of the team, ensuring work is delivered to a high standard and providing feedback and mentoring
Being a great tech role model
Demonstrating the skill and credibility required to ensure the success of our clients' initiatives
Researching and developing new technical approaches to address problems efficiently
Staying up-to-date on developments within the industry, sharing best practices and actively contributing to Artefact's institutional knowledge
Embodying Artefact's values and inspiring others to do the same
Qualifications: Education & experience required
Academic level of education (Bachelor or Master)
A minimum of 3 years of work experience as a data specialist
Verifiable knowledge and experience of web analytics platforms like Google Analytics, Adobe Analytics, WebTrekk etc.
Verifiable knowledge and experience of tag management systems like Google Tag Manager, Tag Commander, Tealium IQ Tag Management, Relay42 etc.
Verifiable knowledge and experience of website optimization tools like Optimizely, Google Optimize, Convert, AB Tasty etc.
Knowledge of Data Management Platforms like BlueKai, Krux, Ysance, Weborama, Relay42, Adobe Audience Manager, Tealium Audience Streams etc.
Knowledge of computer and web-related technologies:
Network techniques/protocols
JavaScript, CSS and HTML (optionally AJAX, JSON, Angular)
Database techniques (REST API's, SQL, No-SQL)
Cloud technology (Google Cloud Platform, Amazon Web Services, Microsoft Azure)
Optionally, knowledge of data processing and data modeling algorithms and techniques
What we are looking for
A Doer: you get things done and inspire your team to do the same
An Analyst: you LOVE data and think every company should take their decisions based on facts
A Pragmatist: you have a no-nonsense mindset that seeks for practical and realistic solutions
A Mentor: your clients and colleagues naturally seek you out for advice
An Adventurer: you're an entrepreneur constantly looking for business opportunities
Why you should join us
Artefact is the place to be: come and build the future of marketing
Progress: every day offers new challenges and new opportunities to learn
Culture: join the best team you could ever imagine
Entrepreneurship: you will be joining a team of driven entrepreneurs. We won't give up until we make a huge dent in this industry!
Come join us!",3.3,"Artefact
3.3","London, England",501 to 1000 Employees,2014,Company - Private,Consulting,Business Services,Unknown / Non-Applicable
